{
  "studentCode": "S-003",
  "date": "2026-05-28",
  "topic": "Reading comprehension — short stories",
  "performance": "Fluency improved significantly. Can identify main idea and supporting details. Vocabulary still limited.",
  "homeworkStatus": "done",
  "observations": "Read aloud with more confidence than last month. Asked good questions about character motivation.",
  "followUps": ["Introduce slightly harder texts next week", "Start vocabulary journal"]
}
